Invoice,StockCode,Description,Quantity,InvoiceDate,Price,Customer ID,Country
490538,82483,WOOD 2 DRAWER CABINET WHITE FINISH,6,2009-12-07 09:14:00,4.95,17850.0,United Kingdom
541660,82482,WOODEN PICTURE FRAME WHITE FINISH,6,2011-01-20 12:20:00,2.55,17787.0,United Kingdom
546850,22674,FRENCH TOILET SIGN BLUE METAL,5,2011-03-17 13:20:00,1.25,13268.0,United Kingdom
559372,22617,BAKING SET SPACEBOY DESIGN,3,2011-07-08 10:23:00,4.95,12461.0,Switzerland
528139,47556B,TEA TIME TEA TOWELS ,1,2010-10-20 15:25:00,2.95,16372.0,United Kingdom
490470,85099C,JUMBO  BAG BAROQUE BLACK WHITE,1,2009-12-06 12:26:00,1.95,16395.0,United Kingdom
528968,85132A,CHARLIE + LOLA BISCUITS TINS,24,2010-10-26 10:22:00,1.95,14298.0,United Kingdom
494011,90200D,PINK SWEETHEART BRACELET,1,2010-01-11 09:30:00,4.33,,United Kingdom
558876,21929,JUMBO BAG PINK VINTAGE PAISLEY,2,2011-07-04 13:36:00,2.08,17841.0,United Kingdom
492418,21070,VINTAGE BILLBOARD MUG ,6,2009-12-16 17:27:00,1.25,15498.0,United Kingdom
505202,17003,BROCADE RING PURSE ,5,2010-04-20 16:21:00,0.43,,United Kingdom
567478,22627,MINT KITCHEN SCALES,2,2011-09-20 13:21:00,8.5,12584.0,Italy
541240,21355,TOAST ITS - I LOVE YOU ,3,2011-01-16 11:07:00,1.25,16206.0,United Kingdom
572092,22909,SET OF 20 VINTAGE CHRISTMAS NAPKINS,1,2011-10-20 14:41:00,0.85,17125.0,United Kingdom
536856,22623,BOX OF VINTAGE JIGSAW BLOCKS ,6,2010-12-03 10:26:00,4.95,13370.0,United Kingdom
513171,22423,REGENCY CAKESTAND 3 TIER,4,2010-06-22 12:14:00,12.75,13097.0,United Kingdom
549316,21558,SKULL LUNCH BOX WITH CUTLERY ,6,2011-04-08 09:54:00,2.55,12705.0,Germany
559861,22033,BOTANICAL ROSE GREETING CARD,48,2011-07-13 10:27:00,0.42,15895.0,United Kingdom
536031,22592,CARDHOLDER HOLLY WREATH METAL,1,2010-11-29 16:45:00,7.62,,United Kingdom
550995,22332,SKULLS PARTY BAG + STICKER SET,8,2011-04-26 08:33:00,1.65,16722.0,United Kingdom
542109,20727,LUNCH BAG  BLACK SKULL.,5,2011-01-25 13:44:00,4.96,,United Kingdom
548860,22997,TRAVEL CARD WALLET UNION JACK,1,2011-04-04 13:38:00,0.42,13263.0,United Kingdom
492176,35271S,GOLD PRINT PAPER BAG,1,2009-12-15 15:21:00,0.19,17841.0,United Kingdom
561882,22948,METAL DECORATION NAUGHTY CHILDREN ,24,2011-07-31 12:52:00,0.85,13388.0,United Kingdom
548194,22115,METAL SIGN EMPIRE TEA,1,2011-03-29 15:30:00,5.79,,United Kingdom
549569,18094C,WHITE AND BLUE CERAMIC OIL BURNER,6,2011-04-10 15:15:00,1.25,15547.0,United Kingdom
500150,22326,ROUND SNACK BOXES SET OF4 WOODLAND ,6,2010-03-04 17:42:00,2.95,14769.0,United Kingdom
518578,21929,JUMBO BAG PINK VINTAGE PAISLEY,10,2010-08-10 12:06:00,1.95,17063.0,United Kingdom
513099,21452,TOADSTOOL MONEY BOX,1,2010-06-21 15:13:00,5.91,,United Kingdom
506579,84997C,BLUE 3 PIECE MINI DOTS CUTLERY SET,18,2010-04-30 14:01:00,3.75,12374.0,Austria
559052,21172,PARTY METAL SIGN ,1,2011-07-05 16:53:00,4.13,,United Kingdom
498725,84997C,BLUE 3 PIECE MINI DOTS CUTLERY SET,2,2010-02-22 15:12:00,3.75,14667.0,United Kingdom
565207,22470,HEART OF WICKER LARGE,6,2011-09-01 16:46:00,2.95,16764.0,United Kingdom
490149,84762B,PINK PICNIC BARBECUE BUCKET,1,2009-12-04 09:43:00,8.65,,United Kingdom
569246,22731,3D CHRISTMAS STAMPS STICKERS ,3,2011-10-03 09:57:00,2.46,14096.0,United Kingdom
537144,21900,"KEY FOB , SHED",2,2010-12-05 13:00:00,0.65,15880.0,United Kingdom
505709,21871,SAVE THE PLANET MUG,6,2010-04-25 12:34:00,1.25,13050.0,United Kingdom
542344,21509,COWBOYS AND INDIANS BIRTHDAY CARD ,2,2011-01-27 11:30:00,0.83,,United Kingdom
499918,21621,VINTAGE UNION JACK BUNTING,6,2010-03-03 12:16:00,8.5,13097.0,United Kingdom
552817,22386,JUMBO BAG PINK POLKADOT,10,2011-05-11 12:47:00,2.08,13136.0,United Kingdom
521476,84660B,BLACK STITCHED WALL CLOCK,1,2010-09-06 12:43:00,3.75,14527.0,United Kingdom
536521,22854,CREAM SWEETHEART EGG HOLDER,1,2010-12-01 12:48:00,4.95,12748.0,United Kingdom
513189,21035,SET/2 RED SPOTTY TEA TOWELS ,12,2010-06-22 14:19:00,2.95,16105.0,United Kingdom
563210,21534,DAIRY MAID LARGE MILK JUG,10,2011-08-14 12:27:00,4.95,16466.0,United Kingdom
506434,84789,ENCHANTED BIRD PLANT CAGE,3,2010-04-29 15:34:00,3.75,13173.0,United Kingdom
506120,21703,BAG 125g SWIRLY MARBLES,12,2010-04-27 14:10:00,0.42,16170.0,United Kingdom
496086,21947,SET OF 6 HEART CHOPSTICKS,4,2010-01-28 19:41:00,1.25,15861.0,United Kingdom
525252,20685,DOORMAT RED RETROSPOT,4,2010-10-04 15:01:00,7.95,14239.0,United Kingdom
558772,21156,RETROSPOT CHILDRENS APRON,2,2011-07-03 16:00:00,1.95,15007.0,United Kingdom
516430,22431,WATERING CAN BLUE ELEPHANT,12,2010-07-20 11:47:00,1.95,17511.0,United Kingdom
538533,22059,CERAMIC STRAWBERRY DESIGN MUG,9,2010-12-13 10:31:00,1.49,14796.0,United Kingdom
517625,22550,HOLIDAY FUN LUDO,1,2010-07-30 11:59:00,3.75,16391.0,United Kingdom
500902,22029,SPACEBOY BIRTHDAY CARD,36,2010-03-11 10:07:00,0.42,13093.0,United Kingdom
532063,20713,JUMBO BAG OWLS,1,2010-11-10 14:48:00,4.21,,United Kingdom
520173,11001,ASSTD DESIGN RACING CAR PEN,128,2010-08-24 13:20:00,1.69,12931.0,United Kingdom
550321,22521,CHILDS GARDEN TROWEL PINK,2,2011-04-17 12:49:00,0.85,16770.0,United Kingdom
574312,22121,NOEL WOODEN BLOCK LETTERS ,1,2011-11-03 17:39:00,5.95,17221.0,United Kingdom
538071,21915,RED  HARMONICA IN BOX ,2,2010-12-09 14:09:00,2.51,,United Kingdom
509748,22523,CHILDS GARDEN FORK PINK,12,2010-05-25 13:51:00,0.85,15217.0,United Kingdom
537153,21918,SET 12 KIDS COLOUR  CHALK STICKS,17,2010-12-05 13:03:00,0.42,16718.0,United Kingdom
569246,22139,RETROSPOT TEA SET CERAMIC 11 PC ,5,2011-10-03 09:57:00,10.79,14096.0,United Kingdom
537370,22907,PACK OF 20 NAPKINS PANTRY DESIGN,1,2010-12-06 12:44:00,0.85,13155.0,United Kingdom
534714,84029E,RED WOOLLY HOTTIE WHITE HEART.,2,2010-11-23 17:31:00,3.75,15965.0,United Kingdom
580062,23319,BOX OF 6 MINI 50'S CRACKERS,3,2011-12-01 13:28:00,2.49,15862.0,United Kingdom
578506,22961,JAM MAKING SET PRINTED,3,2011-11-24 13:01:00,1.45,17458.0,United Kingdom
540976,22394,PAPERWEIGHT KINGS CHOICE ,12,2011-01-12 15:00:00,0.85,12652.0,France
497791,21169,YOU'RE CONFUSING ME METAL SIGN ,2,2010-02-12 12:21:00,1.69,16713.0,United Kingdom
492234,85099B,JUMBO BAG RED WHITE SPOTTY ,30,2009-12-15 19:05:00,1.95,15394.0,United Kingdom
565541,23399,HOME SWEET HOME HANGING HEART,2,2011-09-05 12:00:00,0.85,14159.0,United Kingdom
544677,22583,PACK OF 6 HANDBAG GIFT BOXES,1,2011-02-22 16:13:00,2.55,18196.0,United Kingdom
497602,37449,CERAMIC CAKE STAND + HANGING CAKES,2,2010-02-11 10:25:00,9.95,15765.0,United Kingdom
560033,84978,HANGING HEART JAR T-LIGHT HOLDER,12,2011-07-14 13:28:00,1.25,12388.0,Australia
569414,22726,ALARM CLOCK BAKELIKE GREEN,18,2011-10-04 10:11:00,8.29,,United Kingdom
510744,84991,60 TEATIME FAIRY CAKE CASES,24,2010-06-03 12:34:00,0.55,14911.0,EIRE
505695,84880,WHITE WIRE EGG HOLDER,3,2010-04-25 10:34:00,5.95,16585.0,United Kingdom
516494,22515,CHILDS GARDEN SPADE PINK,1,2010-07-21 10:42:00,2.1,13048.0,United Kingdom
541995,22138,BAKING SET 9 PIECE RETROSPOT ,3,2011-01-25 09:58:00,4.95,13158.0,United Kingdom
545996,21972,SET OF 36 DINOSAUR PAPER DOILIES,1,2011-03-08 14:12:00,1.45,14367.0,United Kingdom
575631,21790,VINTAGE SNAP CARDS,1,2011-11-10 13:41:00,0.85,15184.0,United Kingdom
560782,23244,ROUND STORAGE TIN VINTAGE LEAF,6,2011-07-21 10:10:00,1.95,14769.0,United Kingdom
537179,22697,GREEN REGENCY TEACUP AND SAUCER,8,2010-12-05 13:29:00,2.95,13767.0,United Kingdom
536876,22473,TV DINNER TRAY VINTAGE PAISLEY,1,2010-12-03 11:36:00,11.02,,United Kingdom
543250,21408,SPOTTY PINK DUCK DOORSTOP,3,2011-02-04 14:46:00,4.25,13911.0,United Kingdom
559338,22682,FRENCH BLUE METAL DOOR SIGN 7,1,2011-07-07 16:30:00,2.46,,United Kingdom
562688,22774,RED DRAWER KNOB ACRYLIC EDWARDIAN,4,2011-08-08 13:53:00,1.25,13869.0,United Kingdom
496551,84457,SET/3 RABBITS FLOWER SKIPPPING ROPE,5,2010-02-02 13:13:00,0.85,13975.0,United Kingdom
550500,21668,RED STRIPE CERAMIC DRAWER KNOB,1,2011-04-18 15:26:00,3.29,,United Kingdom
505083,84932D,SMALL ORIENTAL RED FOLDING STOOL,8,2010-04-20 09:56:00,1.95,12623.0,Germany
533836,85123A,WHITE HANGING HEART T-LIGHT HOLDER,32,2010-11-19 10:51:00,2.55,13141.0,United Kingdom
529888,21621,VINTAGE UNION JACK BUNTING,1,2010-10-31 14:06:00,8.5,16595.0,United Kingdom
504142,22362,GLASS JAR PEACOCK BATH SALTS,1,2010-04-11 13:01:00,2.95,13259.0,United Kingdom
573564,20705,MRS ROBOT SOFT TOY,2,2011-10-31 13:58:00,6.95,16127.0,United Kingdom
509425,84050,PINK HEART SHAPE EGG FRYING PAN,6,2010-05-23 13:34:00,1.65,13778.0,United Kingdom
500284,21504,SKULLS GREETING CARD,2,2010-03-05 15:02:00,0.42,,United Kingdom
507029,22551,PLASTERS IN TIN SPACEBOY,12,2010-05-05 14:52:00,1.65,16556.0,United Kingdom
518759,47591D,PINK FAIRY CAKE CHILDRENS APRON,1,2010-08-11 13:38:00,1.95,15005.0,United Kingdom
540551,85169C,EAU DE NIL LOVE BIRD CANDLE,2,2011-01-10 09:43:00,0.85,,United Kingdom
565919,23613,SET 10 XMAS CARDS & BADGES 17070,3,2011-09-07 16:48:00,2.49,,United Kingdom
499472,85063,CREAM SWEETHEART MAGAZINE RACK,1,2010-02-28 12:16:00,16.95,14507.0,United Kingdom
493759,22091,EMPIRE TISSUE BOX,2,2010-01-06 13:56:00,1.25,17965.0,United Kingdom
557636,15060B,FAIRY CAKE DESIGN UMBRELLA,1,2011-06-21 15:41:00,3.75,17841.0,United Kingdom
556048,21591,COSY HOUR CIGAR BOX MATCHES ,24,2011-06-08 13:00:00,1.25,15609.0,United Kingdom
569384,84976,RECTANGULAR SHAPED MIRROR,12,2011-10-03 16:47:00,0.79,15159.0,United Kingdom
581217,22190,LOCAL CAFE MUG,1,2011-12-08 09:20:00,2.46,,United Kingdom
561600,21034,REX CASH+CARRY JUMBO SHOPPER,2,2011-07-28 11:29:00,0.95,15861.0,United Kingdom
529823,21147,JINGLE BELLS TREE DECORATION,4,2010-10-31 11:39:00,2.1,17609.0,United Kingdom
532063,21528,DAIRY MAID TRADITIONAL TEAPOT ,1,2010-11-10 14:48:00,13.57,,United Kingdom
554514,20701,PINK CAT FLORAL CUSHION COVER ,1,2011-05-24 15:58:00,4.13,,United Kingdom
552039,85014A,BLACK/BLUE POLKADOT UMBRELLA,6,2011-05-06 08:10:00,5.95,13081.0,United Kingdom
501960,84406B,CREAM CUPID HEARTS COAT HANGER,8,2010-03-22 12:10:00,3.25,14817.0,United Kingdom
563561,84946,ANTIQUE SILVER T-LIGHT GLASS,288,2011-08-17 14:02:00,1.06,18073.0,United Kingdom
494144,37424,WHITE WITH BLACK CATS MUG,4,2010-01-11 14:35:00,1.66,,United Kingdom
569573,23292,SPACEBOY CHILDRENS CUP,96,2011-10-05 10:11:00,1.05,17511.0,United Kingdom
527471,20867,PINK ROSE FABRIC MIRROR,6,2010-10-18 11:16:00,1.25,14395.0,United Kingdom
574909,21739,COSY SLIPPER SHOES SMALL GREEN,1,2011-11-07 15:40:00,2.95,13673.0,United Kingdom
544474,85230E,STRAWBRY SCENTED VOTIVE CANDLE,24,2011-02-21 09:52:00,0.29,12423.0,Belgium
506261,21746,SMALL RED RETROSPOT WINDMILL,3,2010-04-28 14:45:00,1.25,17605.0,United Kingdom
581164,21155,RED RETROSPOT PEG BAG,6,2011-12-07 14:34:00,2.55,14395.0,United Kingdom
576598,22114,HOT WATER BOTTLE TEA AND SYMPATHY,4,2011-11-15 15:05:00,4.25,13437.0,United Kingdom
566589,20725,LUNCH BAG RED RETROSPOT,10,2011-09-13 14:50:00,1.65,14753.0,United Kingdom
543458,20725,LUNCH BAG RED RETROSPOT,2,2011-02-08 13:28:00,1.65,14587.0,United Kingdom
580613,23349,ROLL WRAP VINTAGE CHRISTMAS,12,2011-12-05 12:03:00,1.25,14759.0,United Kingdom
518752,82486,WOOD S/3 CABINET ANT WHITE FINISH,2,2010-08-11 12:39:00,7.95,17716.0,United Kingdom
521344,84879,ASSORTED COLOUR BIRD ORNAMENT,24,2010-09-03 13:45:00,1.69,16735.0,United Kingdom
579414,23439,HAND WARMER RED LOVE HEART,4,2011-11-29 12:52:00,2.1,14719.0,United Kingdom
507624,21977,PACK OF 60 PINK PAISLEY CAKE CASES,48,2010-05-10 14:34:00,0.55,16873.0,United Kingdom
557560,23173,REGENCY TEAPOT ROSES ,2,2011-06-21 10:37:00,9.95,15329.0,United Kingdom
535585,21769,VINTAGE POST OFFICE CABINET,1,2010-11-26 15:51:00,79.95,18226.0,United Kingdom
500098,21872,GLAMOROUS  MUG,6,2010-03-04 12:32:00,1.25,16771.0,United Kingdom
505337,22195,LARGE HEART MEASURING SPOONS,12,2010-04-21 13:14:00,1.65,12631.0,Finland
523208,22564,ALPHABET STENCIL CRAFT,504,2010-09-21 10:45:00,1.06,17381.0,United Kingdom
